[
  {
    "access_notes": "Sito: https://my.unical.it/",
    "building_id": "uffici-centro-residenziale-e-area-didattica",
    "description": "Per facilitare l’interazione degli studenti con il Centro Residenziale è possibile accedere agli sportelli on-line.",
    "last_verified_at": "2026-02-09T13:50:13.204371+00:00",
    "name": "Front office on-line",
    "opening_hours": "Orari disponibili sulla pagina sorgente",
    "place_id": "office-front-office-on-line",
    "source_id": "unical-services",
    "source_url": "https://www.unical.it/didattica/diritto-allo-studio/front-office-on-line-cr/",
    "type": "OFFICE"
  },
  {
    "access_notes": "Sito: https://my.unical.it/",
    "last_verified_at": "2026-02-09T13:50:13.204371+00:00",
    "name": "Biblioteche",
    "opening_hours": "Orari disponibili sulla pagina sorgente",
    "place_id": "service-biblioteche",
    "source_id": "unical-services",
    "source_url": "https://www.unical.it/campus/vivere-il-campus/biblioteche/",
    "type": "SERVICE"
  },
  {
    "access_notes": "Sito: https://my.unical.it/",
    "description": "L'Ateneo offre alla comunità universitaria e al territorio un sistema di sale convegni attrezzate per lo svolgimento di congressi, conferenze, simposi, mostre, seminari, presentazioni, lectio magistralis, corsi di aggiornamento, convention , career day e giornate di recruitment .",
    "last_verified_at": "2026-02-09T13:50:13.204371+00:00",
    "name": "Centro Congressi",
    "opening_hours": "Orari disponibili sulla pagina sorgente",
    "place_id": "service-centro-congressi",
    "source_id": "unical-services",
    "source_url": "https://www.unical.it/campus/vivere-il-campus/centro-congressi/",
    "type": "SERVICE"
  },
  {
    "access_notes": "Sito: https://my.unical.it/",
    "building_id": "cla-centro-linguistico-d-ateneo",
    "email": "maria.sasso@unical.it",
    "last_verified_at": "2026-02-09T13:50:13.204371+00:00",
    "name": "Centro Linguistico Di Ateneo",
    "opening_hours": "Orari disponibili sulla pagina sorgente",
    "place_id": "service-centro-linguistico-di-ateneo",
    "source_id": "unical-services",
    "source_url": "https://www.unical.it/campus/vivere-il-campus/centro-linguistico-di-ateneo/",
    "type": "SERVICE"
  },
  {
    "access_notes": "Sito: https://my.unical.it/",
    "building_id": "centro-sanitario",
    "email": "118cosenza@tiscali.it",
    "last_verified_at": "2026-02-09T13:50:13.204371+00:00",
    "name": "Centro Sanitario",
    "place_id": "service-centro-sanitario",
    "source_id": "unical-services",
    "source_url": "https://www.unical.it/campus/vivere-il-campus/centro-sanitario/",
    "type": "SERVICE"
  },
  {
    "access_notes": "Sito: https://my.unical.it/",
    "building_id": "centro-universitario-sportivo",
    "description": "Lo sport è una componente essenziale nel Campus. Il Cus – Centro universitario sportivo d’ateneo – è una vera cittadella dello sport e del tempo libero, il motore di un’intensa attività che consente a studenti, docenti, personale tecnico-amministrativo e cittadini dell’area urbana di praticare numerose discipline, anche a livello agonistico con risultati significativi ottenuti in vari campionati universitari nazionali.",
    "last_verified_at": "2026-02-09T13:50:13.204371+00:00",
    "name": "Centro Sportivo",
    "place_id": "service-centro-sportivo",
    "source_id": "unical-services",
    "source_url": "https://www.unical.it/campus/vivere-il-campus/centro-sportivo/",
    "type": "SERVICE"
  },
  {
    "access_notes": "Sito: https://my.unical.it/",
    "building_id": "uffici-centro-residenziale-e-area-didattica",
    "description": "Che cos'è la borsa di studio Lo scopo della borsa di studio è quello di consentire agli studenti capaci e meritevoli, anche se privi di mezzi economici, di raggiungere i gradi più alti degli studi ovvero quello di sostenere le spese di mantenimento dello studente presso la sede universitaria. La borsa di studio è composta da una quota in servizi (alloggio e mensa) e da una quota monetaria e dà inoltre diritto all’esenzione completa dalle tasse universitarie e ad altri interventi finalizzati ad agevolare il percorso didattico (mobilità internazionale, premio di laurea, fruizione a tariffe ridotte degli impianti sportivi del campus, ecc.).",
    "last_verified_at": "2026-02-09T13:50:13.204371+00:00",
    "name": "Diritto allo studio",
    "place_id": "service-diritto-allo-studio",
    "source_id": "unical-services",
    "source_url": "https://www.unical.it/didattica/diritto-allo-studio/borse-di-studio/",
    "type": "SERVICE"
  },
  {
    "access_notes": "Sito: https://my.unical.it/",
    "building_id": "centro-sanitario",
    "last_verified_at": "2026-02-09T13:50:13.204371+00:00",
    "name": "Emergenze e assistenza sanitaria",
    "place_id": "service-emergenze-e-assistenza-sanitaria",
    "source_id": "unical-services",
    "source_url": "https://www.unical.it/didattica/diritto-allo-studio/emergenze-e-assistenza-sanitaria/",
    "type": "SERVICE"
  },
  {
    "access_notes": "Sito: https://my.unical.it/",
    "building_id": "uffici-centro-residenziale-e-area-didattica",
    "description": "Il Centro Residenziale ha attivato degli indirizzi di posta elettronica ai quali gli studenti possono rivolgersi per presentare richieste o segnalare problemi inerenti: le borse di studio, i premi di laurea, i contributi per la mobilità internazionale, i servizi alloggi e mensa, il portale dei servizi online del Centro Residenziale, etc.",
    "last_verified_at": "2026-02-09T13:50:13.204371+00:00",
    "name": "Helpdesk e contatti CR",
    "place_id": "service-helpdesk-e-contatti-cr",
    "source_id": "unical-services",
    "source_url": "https://www.unical.it/didattica/diritto-allo-studio/segnalazioni-e-richieste-cr/",
    "type": "SERVICE"
  },
  {
    "access_notes": "Sito: https://my.unical.it/",
    "building_id": "cubi-7-11b",
    "last_verified_at": "2026-02-09T13:50:13.204371+00:00",
    "name": "Orientamento",
    "place_id": "service-orientamento",
    "source_id": "unical-services",
    "source_url": "https://www.unical.it/didattica/orientamento/career-service/",
    "type": "SERVICE"
  },
  {
    "access_notes": "Sito: https://my.unical.it/",
    "description": "Il “Polo d'Infanzia” è stato attivato nel 2012 per favorire la conciliazione dei tempi di vita privata e di lavoro per le famiglie della comunità accademica e, da questo punto di vista, rappresenta ancora oggi una realtà pressoché unica nel territorio.",
    "last_verified_at": "2026-02-09T13:50:13.204371+00:00",
    "name": "Polo Infanzia",
    "place_id": "service-polo-infanzia",
    "source_id": "unical-services",
    "source_url": "https://www.unical.it/campus/vivere-il-campus/polo-infanzia/",
    "type": "SERVICE"
  },
  {
    "access_notes": "Sito: https://my.unical.it/",
    "building_id": "uffici-centro-residenziale-e-area-didattica",
    "description": "Per informazioni sulle modalità di assegnazione delle residenze agli studenti consulta il bando di concorso e il Regolamento sui Servizi del Centro Residenziale .",
    "email": "francesco.rocchetto@unical.it",
    "last_verified_at": "2026-02-09T13:50:13.204371+00:00",
    "name": "Quartieri",
    "place_id": "service-quartieri",
    "source_id": "unical-services",
    "source_url": "https://www.unical.it/campus/vivere-il-campus/quartieri/",
    "type": "SERVICE"
  },
  {
    "access_notes": "Sito: https://my.unical.it/",
    "description": "Via Pietro Bucci 87036 Rende CS Posta certificata C.F. 80003950781 / P.I. 00419160783",
    "last_verified_at": "2026-02-09T13:50:13.204371+00:00",
    "name": "Servizi ICT",
    "place_id": "service-servizi-ict",
    "source_id": "unical-services",
    "source_url": "https://www.unical.it/servizi-ict/servizi-digitali-studenti/",
    "type": "SERVICE"
  },
  {
    "access_notes": "Sito: https://my.unical.it/",
    "building_id": "uffici-centro-residenziale-e-area-didattica",
    "description": "I servizi erogati online dal Centro Residenziale consentono a studenti, docenti e personale tecnico-amministrativo di richiedere e gestire i benefici ed i servizi erogati nel campus (borse di studio, alloggi studenti, foresterie, servizio mensa, premi di laurea, contributi, ecc.).",
    "email": "servizi_informativi.cr@unical.it",
    "last_verified_at": "2026-02-09T13:50:13.204371+00:00",
    "name": "Servizi online Centro Residenziale",
    "place_id": "service-servizi-online-centro-residenziale",
    "source_id": "unical-services",
    "source_url": "https://www.unical.it/didattica/diritto-allo-studio/serv-cr/",
    "type": "SERVICE"
  },
  {
    "access_notes": "Sito: https://my.unical.it/",
    "building_id": "uffici-centro-residenziale-e-area-didattica",
    "description": "Il servizio è rivolto al personale universitario (docente e tecnico-amministrativo) di ruolo; in caso di disponibilità, possono usufruirne anche tutti coloro i quali abbiano un rapporto di interesse con l’Università della Calabria.",
    "email": "direzione.cr@unical.it",
    "last_verified_at": "2026-02-09T13:50:13.204371+00:00",
    "name": "Servizio Foresteria",
    "place_id": "service-servizio-foresteria",
    "source_id": "unical-services",
    "source_url": "https://www.unical.it/campus/vivere-il-campus/servizio-foresteria/",
    "type": "SERVICE"
  },
  {
    "access_notes": "Sito: https://my.unical.it/",
    "description": "La comunità accademica può usufruire del servizio di ristorazione che viene erogato attraverso le cinque mense presenti nel campus universitario, in gestione indiretta, a tariffe differenziate in base al reddito,",
    "email": "direzione.cr@unical.it",
    "last_verified_at": "2026-02-09T13:50:13.204371+00:00",
    "name": "Servizio Mensa",
    "opening_hours": "Orari disponibili sulla pagina sorgente",
    "place_id": "service-servizio-mensa",
    "source_id": "unical-services",
    "source_url": "https://www.unical.it/campus/vivere-il-campus/servizio-mensa/",
    "type": "SERVICE"
  },